{"flightId":"a60e67_1777066620","registration":"N49GT","icao24":"a60e67","points":[{"t":1777066620,"lat":41.5653,"lon":-73.82140000000001,"altFt":3500,"gsKt":95,"trackDeg":95},{"t":1777066650,"lat":41.56294679384066,"lon":-73.80231422185113,"altFt":3605,"gsKt":95.55555555555556,"trackDeg":95.13888888888889},{"t":1777066680,"lat":41.56059043193355,"lon":-73.78322983468651,"altFt":3708,"gsKt":96.11111111111111,"trackDeg":95.27777777777777},{"t":1777066710,"lat":41.55823091477024,"lon":-73.76414684015313,"altFt":3811,"gsKt":96.66666666666667,"trackDeg":95.41666666666667},{"t":1777066740,"lat":41.555868242842855,"lon":-73.74506523989686,"altFt":3910,"gsKt":97.22222222222223,"trackDeg":95.55555555555556},{"t":1777066770,"lat":41.55350241664408,"lon":-73.72598503556254,"altFt":4007,"gsKt":97.77777777777777,"trackDeg":95.69444444444444},{"t":1777066800,"lat":41.55113343666714,"lon":-73.70690622879377,"altFt":4100,"gsKt":98.33333333333333,"trackDeg":95.83333333333333},{"t":1777066830,"lat":41.548761303405904,"lon":-73.6878288212331,"altFt":4188,"gsKt":98.88888888888889,"trackDeg":95.97222222222223},{"t":1777066860,"lat":41.546386017354706,"lon":-73.6687528145219,"altFt":4271,"gsKt":99.44444444444444,"trackDeg":96.11111111111111},{"t":1777066890,"lat":41.54400757900849,"lon":-73.64967821030048,"altFt":4349,"gsKt":100,"trackDeg":96.25},{"t":1777066920,"lat":41.541625988862776,"lon":-73.63060501020796,"altFt":4419,"gsKt":100.55555555555556,"trackDeg":96.38888888888889},{"t":1777066950,"lat":41.53924124741361,"lon":-73.61153321588239,"altFt":4483,"gsKt":101.11111111111111,"trackDeg":96.52777777777777},{"t":1777066980,"lat":41.536853355157625,"lon":-73.59246282896063,"altFt":4539,"gsKt":101.66666666666667,"trackDeg":96.66666666666667},{"t":1777067010,"lat":41.534462312592,"lon":-73.57339385107845,"altFt":4588,"gsKt":102.22222222222223,"trackDeg":96.80555555555556},{"t":1777067040,"lat":41.53206812021449,"lon":-73.55432628387052,"altFt":4628,"gsKt":102.77777777777777,"trackDeg":96.94444444444444},{"t":1777067070,"lat":41.529670778523396,"lon":-73.5352601289703,"altFt":4659,"gsKt":103.33333333333333,"trackDeg":97.08333333333333},{"t":1777067100,"lat":41.5272702880176,"lon":-73.51619538801015,"altFt":4682,"gsKt":103.88888888888889,"trackDeg":97.22222222222223},{"t":1777067130,"lat":41.5248666491965,"lon":-73.49713206262132,"altFt":4695,"gsKt":104.44444444444444,"trackDeg":97.36111111111111},{"t":1777067160,"lat":41.5224598625601,"lon":-73.47807015443392,"altFt":4700,"gsKt":105,"trackDeg":97.5},{"t":1777067190,"lat":41.520049928608934,"lon":-73.4590096650769,"altFt":4695,"gsKt":105.55555555555556,"trackDeg":97.63888888888889},{"t":1777067220,"lat":41.5176368478441,"lon":-73.4399505961781,"altFt":4682,"gsKt":106.11111111111111,"trackDeg":97.77777777777777},{"t":1777067250,"lat":41.515220620767266,"lon":-73.42089294936417,"altFt":4659,"gsKt":106.66666666666667,"trackDeg":97.91666666666667},{"t":1777067280,"lat":41.51280124788063,"lon":-73.40183672626073,"altFt":4628,"gsKt":107.22222222222223,"trackDeg":98.05555555555556},{"t":1777067310,"lat":41.51037872968696,"lon":-73.38278192849212,"altFt":4588,"gsKt":107.77777777777777,"trackDeg":98.19444444444444},{"t":1777067340,"lat":41.5079530666896,"lon":-73.36372855768164,"altFt":4539,"gsKt":108.33333333333333,"trackDeg":98.33333333333333},{"t":1777067370,"lat":41.50552425939243,"lon":-73.34467661545143,"altFt":4483,"gsKt":108.88888888888889,"trackDeg":98.47222222222223},{"t":1777067400,"lat":41.50309230829987,"lon":-73.32562610342248,"altFt":4419,"gsKt":109.44444444444444,"trackDeg":98.61111111111111},{"t":1777067430,"lat":41.500657213916924,"lon":-73.3065770232146,"altFt":4349,"gsKt":110,"trackDeg":98.75},{"t":1777067460,"lat":41.498218976749115,"lon":-73.28752937644651,"altFt":4271,"gsKt":110.55555555555556,"trackDeg":98.88888888888889},{"t":1777067490,"lat":41.49577759730257,"lon":-73.26848316473578,"altFt":4188,"gsKt":111.11111111111111,"trackDeg":99.02777777777777},{"t":1777067520,"lat":41.493333076083914,"lon":-73.24943838969881,"altFt":4100,"gsKt":111.66666666666667,"trackDeg":99.16666666666667},{"t":1777067550,"lat":41.490885413600374,"lon":-73.23039505295084,"altFt":4007,"gsKt":112.22222222222223,"trackDeg":99.30555555555556},{"t":1777067580,"lat":41.4884346103597,"lon":-73.211353156106,"altFt":3910,"gsKt":112.77777777777777,"trackDeg":99.44444444444444},{"t":1777067610,"lat":41.48598066687019,"lon":-73.19231270077725,"altFt":3811,"gsKt":113.33333333333333,"trackDeg":99.58333333333333},{"t":1777067640,"lat":41.48352358364071,"lon":-73.17327368857643,"altFt":3708,"gsKt":113.88888888888889,"trackDeg":99.72222222222223},{"t":1777067670,"lat":41.48106336118065,"lon":-73.15423612111417,"altFt":3605,"gsKt":114.44444444444444,"trackDeg":99.86111111111111},{"t":1777067700,"lat":41.4786,"lon":-73.1352,"altFt":3500,"gsKt":115,"trackDeg":100}],"simplification":{"maxPoints":2000,"epsilonDeg":0.02}}